{
  "drift": [
    {
      "address": "aws_sqs_queue.events",
      "actions": [
        "update"
      ],
      "changed_attributes": [
        "visibility_timeout_seconds"
      ]
    },
    {
      "address": "aws_ssm_parameter.flag",
      "actions": [
        "delete"
      ],
      "changed_attributes": [
        "allowed_pattern",
        "arn",
        "data_type",
        "description",
        "has_value_wo",
        "id",
        "key_id",
        "name",
        "region",
        "tags_all",
        "tier",
        "type",
        "value",
        "version"
      ]
    }
  ],
  "findings": [],
  "generated_at": "2026-10-10T12:00:00Z",
  "moves": [],
  "policy": {
    "configured": false,
    "exclusions": [],
    "path": null
  },
  "privacy": {
    "note": "tfimpact runs locally. Nothing is sent anywhere; sensitive values are masked.",
    "telemetry": false,
    "uploaded": false
  },
  "routine": [
    {
      "type": "aws_cloudwatch_log_group",
      "addresses": [
        "aws_cloudwatch_log_group.app"
      ],
      "summary": "`retention_in_days` 30 → 90"
    },
    {
      "type": "aws_sqs_queue",
      "addresses": [
        "aws_sqs_queue.events"
      ],
      "summary": "`visibility_timeout_seconds` 120 → 30"
    },
    {
      "type": "aws_ssm_parameter",
      "addresses": [
        "aws_ssm_parameter.flag"
      ],
      "summary": "created"
    }
  ],
  "schema_version": "1.1",
  "source": {
    "format_version": "1.2",
    "kind": "terraform-plan",
    "root": "../../testdata/plans/drift/plan.json",
    "terraform_version": "1.15.5"
  },
  "summary": {
    "changes": {
      "create": 1,
      "update": 2,
      "delete": 0,
      "replace": 0,
      "no_op": 0,
      "read": 0,
      "forget": 0,
      "move": 0,
      "import": 0,
      "drift": 2,
      "tag_only": 0
    },
    "excluded_files": 0,
    "findings": 0,
    "resources": 3,
    "scanned_files": 1,
    "severity": {
      "critical": 0,
      "high": 0,
      "low": 0,
      "medium": 0
    },
    "skipped_files": 0,
    "suppressed_findings": 0,
    "total_findings": 0
  },
  "tool": "tfimpact",
  "tool_version": "test"
}
