{
  "drift": [],
  "findings": [
    {
      "domain": "change",
      "id": "fnd_ab77ceae02e764c4",
      "line": null,
      "metadata": {
        "action_reason": "delete_because_no_resource_config",
        "created": "aws_s3_bucket.audit_logs",
        "deleted": "aws_s3_bucket.logs",
        "identity": "bucket",
        "resource_type": "aws_s3_bucket"
      },
      "observed": "`aws_s3_bucket.logs` will be destroyed because it left the configuration, and `aws_s3_bucket.audit_logs` will be created with the same `bucket` (\"fixture-alb-access-logs-eu-west-2\"). Terraform does not know they are the same object. Every object and object version in the bucket would be lost with the S3 bucket.",
      "path": "aws_s3_bucket.logs",
      "product": "tfimpact",
      "recommendation": "Add a moved block (`from = aws_s3_bucket.logs`, `to = aws_s3_bucket.audit_logs`) so Terraform changes the address in state instead. Applying as planned also tries to create a resource with the same bucket, which fails for globally named resources.",
      "rule_id": "PLAN-RENAME-001",
      "severity": "critical",
      "suppressed": false,
      "suppression_expires": null,
      "suppression_reason": null,
      "tags": [
        "aws_s3_bucket",
        "rename"
      ],
      "title": "`aws_s3_bucket.logs` is renamed to `aws_s3_bucket.audit_logs` without a moved block, so it will be destroyed and recreated"
    },
    {
      "domain": "change",
      "id": "fnd_515a9f8a15ec19f5",
      "line": null,
      "metadata": {
        "action_reason": "delete_because_no_resource_config",
        "resource_type": "aws_s3_bucket_versioning"
      },
      "observed": "The S3 bucket versioning is destroyed because it is no longer in the configuration.",
      "path": "aws_s3_bucket_versioning.logs",
      "product": "tfimpact",
      "recommendation": "Confirm nothing outside this configuration still depends on it.",
      "rule_id": "PLAN-DELETE-001",
      "severity": "low",
      "suppressed": false,
      "suppression_expires": null,
      "suppression_reason": null,
      "tags": [
        "aws_s3_bucket_versioning",
        "destroy"
      ],
      "title": "`aws_s3_bucket_versioning.logs` will be destroyed"
    }
  ],
  "generated_at": "2026-10-10T12:00:00Z",
  "moves": [
    {
      "from": "aws_sqs_queue.events",
      "to": "aws_sqs_queue.event_queue"
    }
  ],
  "policy": {
    "configured": false,
    "exclusions": [],
    "path": null
  },
  "privacy": {
    "note": "tfimpact runs locally. Nothing is sent anywhere; sensitive values are masked.",
    "telemetry": false,
    "uploaded": false
  },
  "routine": [
    {
      "type": "aws_s3_bucket_versioning",
      "addresses": [
        "aws_s3_bucket_versioning.audit_logs"
      ],
      "summary": "created"
    }
  ],
  "schema_version": "1.1",
  "source": {
    "format_version": "1.2",
    "kind": "terraform-plan",
    "root": "../../testdata/plans/rename/plan.json",
    "terraform_version": "1.15.5"
  },
  "summary": {
    "changes": {
      "create": 2,
      "update": 0,
      "delete": 2,
      "replace": 0,
      "no_op": 2,
      "read": 0,
      "forget": 0,
      "move": 1,
      "import": 0,
      "drift": 0,
      "tag_only": 0
    },
    "excluded_files": 0,
    "findings": 2,
    "resources": 6,
    "scanned_files": 1,
    "severity": {
      "critical": 1,
      "high": 0,
      "low": 1,
      "medium": 0
    },
    "skipped_files": 0,
    "suppressed_findings": 0,
    "total_findings": 2
  },
  "tool": "tfimpact",
  "tool_version": "test"
}
